{"artifactId":"calibration-artifact-complete-1","calibrationRunId":"calibration-run-complete-1","canonicalizationVersion":"rubrist-canonical-json/v1","contract":"rubrist/binary-calibration-private-ledger/v2","itemCount":2,"projectId":"project-fixture","records":[{"attemptState":"terminal","commitmentSalt":"1111111111111111111111111111111111111111111111111111111111111111","datasetRevisionItemDigest":"sha256:0101010101010101010101010101010101010101010101010101010101010101","physicalProviderCalls":2,"providerObservation":{"observedModel":"claude-sonnet-4-6","observedVersion":null,"provider":"anthropic","systemFingerprint":null,"upstreamProvider":null},"result":{"outcome":"pass","state":"outcome"},"trialIndex":0,"truthLabel":"pass"},{"attemptState":"terminal","commitmentSalt":"2222222222222222222222222222222222222222222222222222222222222222","datasetRevisionItemDigest":"sha256:0202020202020202020202020202020202020202020202020202020202020202","physicalProviderCalls":1,"providerObservation":{"observedModel":"claude-sonnet-4-6","observedVersion":null,"provider":"anthropic","systemFingerprint":null,"upstreamProvider":null},"result":{"outcome":"abstain","state":"outcome"},"trialIndex":0,"truthLabel":"fail"}],"requestedProvider":"anthropic","revisionDigest":"sha256:4444444444444444444444444444444444444444444444444444444444444444","schemaVersion":2,"trialsPerItem":1}