{"artifactId":"calibration-artifact-incomplete-1","calibrationRunId":"calibration-run-incomplete-1","canonicalizationVersion":"rubrist-canonical-json/v1","contract":"rubrist/binary-calibration-private-ledger/v2","itemCount":3,"projectId":"project-fixture","records":[{"attemptState":"terminal","commitmentSalt":"1111111111111111111111111111111111111111111111111111111111111111","datasetRevisionItemDigest":"sha256:aaaaaaaaaaaaaaaaaaaaaaaaaaaaaaaaaaaaaaaaaaaaaaaaaaaaaaaaaaaaaaaa","physicalProviderCalls":1,"providerObservation":{"observedModel":"anthropic/claude-sonnet-4.6","observedVersion":null,"provider":"openrouter","systemFingerprint":null,"upstreamProvider":"Anthropic"},"result":{"outcome":"pass","state":"outcome"},"trialIndex":0,"truthLabel":"pass"},{"attemptState":"started","commitmentSalt":"2222222222222222222222222222222222222222222222222222222222222222","datasetRevisionItemDigest":"sha256:bbbbbbbbbbbbbbbbbbbbbbbbbbbbbbbbbbbbbbbbbbbbbbbbbbbbbbbbbbbbbbbb","physicalProviderCalls":1,"providerObservation":{"observedModel":null,"observedVersion":null,"provider":"openrouter","systemFingerprint":null,"upstreamProvider":null},"result":{"failureKind":"outcome_unknown","state":"failure"},"trialIndex":0,"truthLabel":"pass"},{"attemptState":"not_started","commitmentSalt":"3333333333333333333333333333333333333333333333333333333333333333","datasetRevisionItemDigest":"sha256:cccccccccccccccccccccccccccccccccccccccccccccccccccccccccccccccc","physicalProviderCalls":0,"providerObservation":{"observedModel":null,"observedVersion":null,"provider":"openrouter","systemFingerprint":null,"upstreamProvider":null},"result":{"state":"not_attempted"},"trialIndex":0,"truthLabel":"fail"}],"requestedProvider":"openrouter","revisionDigest":"sha256:5555555555555555555555555555555555555555555555555555555555555555","schemaVersion":2,"trialsPerItem":1}